{"adapter_version":"bahamas-inspection-adapter.v1","case_hashes":["444067172b0a398ceef331f34b93f712e45fc44db7ceb6f0a630d982af6c1f71"],"collection_ref":"synthetic:collection-1","country_code":"bs","definition_hash":"aaaaaaaaaaaaaaaaaaaaaaaaaaaaaaaaaaaaaaaaaaaaaaaaaaaaaaaaaaaaaaaa","definition_version":"0.1.6","parents":[],"schema_version":"inspection-collection.v1","source_snapshot_date":"2026-09-01"}
